{"expiresAt":"2027-06-30T00:00:00Z","manifestVersion":"1.0.0","packages":[{"bundlePatch":"./cordis.patch.yml","integrity":"sha512-DRQbIikwNz5FTFNaYWhvdn2Ei5KZoKeutbzDytHY3+bt9PsCCRAXHiUsMzpBSE9WXWRrcnmAh46VnKOqsbi/xg==","packageName":"dsh-plugin-safe","revoked":false,"runtime":{"cordisRuntimeVersion":"^4.0.0","dshRuntimeVersion":"^0.1.1-rc.2"},"version":"1.2.3"},{"bundlePatch":"./cordis.patch.yml","integrity":"sha512-qqqqqqqqqqqqqqqqqqqqqqqqqqqqqqqqqqqqqqqqqqqqqqqqqqqqqqqqqqqqqqqqqqqqqqqqqqqqqqqqqqqqqg==","packageName":"dsh-plugin-retired","revoked":true,"runtime":{"dshRuntimeVersion":"^0.1.0"},"version":"2.0.0"}],"sequence":42,"signature":{"keyId":"company-catalog-2026.01","publicKey":"UMS5KAuUnrxzIOfqvU2wmH0HJRQGhEcGwJmwsoF4yYw=","value":"WME9McyBDFQUi/ldLnqndAe73HQYB/IxeMpdkBb0SqdhSgYahFbYiyjiIwDJlPbb3pxROZfmkO/A4+/xsz3ZBg=="}}